{"schema_version":1,"profile":"states-v1","recording_id":"neow-map-prefix","actions_sha256":"9732df85c94ab0bd6b2ad4effe5577061b7bd983ebff6fed186521e0812b28fc","reference":{"revision":"084d1aa3d8e118ca7ce8d8774ad16d6be9c92367","game_dll_sha256":"0861bfa1df347538d932f22d580e75420f08082792eb914e53b4882764acdbe9","adapter_sha256":"4604bfe7225307dc8689f83e62ad3be914819246ba14d2f421e9a3c0560e5df1","assembly_mvid":"73b63ee0-6c0a-47bb-b0d1-b21f6d94222e","runtime_version":"9.0.4"},"initial":{"acts":[{"id":"ACT.OVERGROWTH","rooms":{"ancient_id":"EVENT.NEOW","boss_encounters_visited":0,"boss_id":"ENCOUNTER.CEREMONIAL_BEAST_BOSS","elite_encounter_ids":["ENCOUNTER.PHROG_PARASITE_ELITE","ENCOUNTER.BYRDONIS_ELITE","ENCOUNTER.BYGONE_EFFIGY_ELITE","ENCOUNTER.BYRDONIS_ELITE","ENCOUNTER.BYGONE_EFFIGY_ELITE","ENCOUNTER.PHROG_PARASITE_ELITE","ENCOUNTER.BYGONE_EFFIGY_ELITE","ENCOUNTER.BYRDONIS_ELITE","ENCOUNTER.PHROG_PARASITE_ELITE","ENCOUNTER.BYGONE_EFFIGY_ELITE","ENCOUNTER.PHROG_PARASITE_ELITE","ENCOUNTER.BYRDONIS_ELITE","ENCOUNTER.PHROG_PARASITE_ELITE","ENCOUNTER.BYRDONIS_ELITE","ENCOUNTER.BYGONE_EFFIGY_ELITE"],"elite_encounters_visited":0,"event_ids":["EVENT.THIS_OR_THAT","EVENT.MORPHIC_GROVE","EVENT.BRAIN_LEECH","EVENT.WOOD_CARVINGS","EVENT.WELCOME_TO_WONGOS","EVENT.SAPPHIRE_SEED","EVENT.POTION_COURIER","EVENT.UNREST_SITE","EVENT.CRYSTAL_SPHERE","EVENT.LUMINOUS_CHOIR","EVENT.SUNKEN_STATUE","EVENT.SLIPPERY_BRIDGE","EVENT.TEA_MASTER","EVENT.SYMBIOTE","EVENT.WELLSPRING","EVENT.DOLL_ROOM","EVENT.WAR_HISTORIAN_REPY","EVENT.ROOM_FULL_OF_CHEESE","EVENT.TABLET_OF_TRUTH","EVENT.RANWID_THE_ELDER","EVENT.BYRDONIS_NEST","EVENT.THE_FUTURE_OF_POTIONS","EVENT.RELIC_TRADER","EVENT.THE_LEGENDS_WERE_TRUE","EVENT.AROMA_OF_CHAOS","EVENT.FAKE_MERCHANT","EVENT.DENSE_VEGETATION","EVENT.JUNGLE_MAZE_ADVENTURE","EVENT.WHISPERING_HOLLOW","EVENT.SELF_HELP_BOOK","EVENT.STONE_OF_ALL_TIME"],"events_visited":1,"normal_encounter_ids":["ENCOUNTER.SLIMES_WEAK","ENCOUNTER.FUZZY_WURM_CRAWLER_WEAK","ENCOUNTER.SHRINKER_BEETLE_WEAK","ENCOUNTER.RUBY_RAIDERS_NORMAL","ENCOUNTER.SLIMES_NORMAL","ENCOUNTER.MAWLER_NORMAL","ENCOUNTER.CUBEX_CONSTRUCT_NORMAL","ENCOUNTER.SLITHERING_STRANGLER_NORMAL","ENCOUNTER.OVERGROWTH_CRAWLERS","ENCOUNTER.FLYCONID_NORMAL","ENCOUNTER.NIBBITS_NORMAL","ENCOUNTER.VINE_SHAMBLER_NORMAL","ENCOUNTER.FOGMOG_NORMAL","ENCOUNTER.INKLETS_NORMAL","ENCOUNTER.SNAPPING_JAXFRUIT_NORMAL"],"normal_encounters_visited":0,"second_boss_id":null},"saved_map":{"boss":{"can_modify":true,"children":null,"coord":{"col":3,"row":16},"type":"boss"},"height":16,"points":[{"can_modify":false,"children":[{"col":0,"row":2}],"coord":{"col":0,"row":1},"type":"monster"},{"can_modify":true,"children":[{"col":0,"row":3}],"coord":{"col":0,"row":2},"type":"monster"},{"can_modify":true,"children":[{"col":0,"row":4},{"col":1,"row":4}],"coord":{"col":0,"row":3},"type":"monster"},{"can_modify":true,"children":[{"col":1,"row":5},{"col":0,"row":5}],"coord":{"col":0,"row":4},"type":"shop"},{"can_modify":true,"children":[{"col":0,"row":6}],"coord":{"col":0,"row":5},"type":"monster"},{"can_modify":true,"children":[{"col":0,"row":7}],"coord":{"col":0,"row":6},"type":"rest_site"},{"can_modify":true,"children":[{"col":0,"row":8}],"coord":{"col":0,"row":7},"type":"unknown"},{"can_modify":true,"children":[{"col":1,"row":9}],"coord":{"col":0,"row":8},"type":"monster"},{"can_modify":true,"children":[{"col":1,"row":5}],"coord":{"col":1,"row":4},"type":"monster"},{"can_modify":true,"children":[{"col":2,"row":6}],"coord":{"col":1,"row":5},"type":"unknown"},{"can_modify":false,"children":[{"col":1,"row":10},{"col":2,"row":10}],"coord":{"col":1,"row":9},"type":"treasure"},{"can_modify":true,"children":[{"col":1,"row":11}],"coord":{"col":1,"row":10},"type":"monster"},{"can_modify":true,"children":[{"col":2,"row":12}],"coord":{"col":1,"row":11},"type":"rest_site"},{"can_modify":false,"children":[{"col":3,"row":16}],"coord":{"col":1,"row":15},"type":"rest_site"},{"can_modify":true,"children":[{"col":3,"row":7},{"col":2,"row":7}],"coord":{"col":2,"row":6},"type":"monster"},{"can_modify":true,"children":[{"col":2,"row":8}],"coord":{"col":2,"row":7},"type":"rest_site"},{"can_modify":true,"children":[{"col":1,"row":9}],"coord":{"col":2,"row":8},"type":"monster"},{"can_modify":true,"children":[{"col":2,"row":11}],"coord":{"col":2,"row":10},"type":"unknown"},{"can_modify":true,"children":[{"col":2,"row":12}],"coord":{"col":2,"row":11},"type":"monster"},{"can_modify":true,"children":[{"col":2,"row":13},{"col":3,"row":13}],"coord":{"col":2,"row":12},"type":"monster"},{"can_modify":true,"children":[{"col":2,"row":14}],"coord":{"col":2,"row":13},"type":"unknown"},{"can_modify":true,"children":[{"col":1,"row":15}],"coord":{"col":2,"row":14},"type":"elite"},{"can_modify":false,"children":[{"col":3,"row":2}],"coord":{"col":3,"row":1},"type":"monster"},{"can_modify":true,"children":[{"col":3,"row":3}],"coord":{"col":3,"row":2},"type":"monster"},{"can_modify":true,"children":[{"col":3,"row":4}],"coord":{"col":3,"row":3},"type":"monster"},{"can_modify":true,"children":[{"col":4,"row":5}],"coord":{"col":3,"row":4},"type":"monster"},{"can_modify":true,"children":[{"col":3,"row":8}],"coord":{"col":3,"row":7},"type":"unknown"},{"can_modify":true,"children":[{"col":3,"row":9}],"coord":{"col":3,"row":8},"type":"rest_site"},{"can_modify":false,"children":[{"col":3,"row":10}],"coord":{"col":3,"row":9},"type":"treasure"},{"can_modify":true,"children":[{"col":3,"row":11},{"col":4,"row":11}],"coord":{"col":3,"row":10},"type":"monster"},{"can_modify":true,"children":[{"col":2,"row":12}],"coord":{"col":3,"row":11},"type":"elite"},{"can_modify":true,"children":[{"col":4,"row":13}],"coord":{"col":3,"row":12},"type":"monster"},{"can_modify":true,"children":[{"col":2,"row":14},{"col":3,"row":14}],"coord":{"col":3,"row":13},"type":"monster"},{"can_modify":true,"children":[{"col":3,"row":15}],"coord":{"col":3,"row":14},"type":"monster"},{"can_modify":false,"children":[{"col":3,"row":16}],"coord":{"col":3,"row":15},"type":"rest_site"},{"can_modify":false,"children":[{"col":4,"row":2}],"coord":{"col":4,"row":1},"type":"monster"},{"can_modify":true,"children":[{"col":3,"row":3}],"coord":{"col":4,"row":2},"type":"unknown"},{"can_modify":true,"children":[{"col":5,"row":6}],"coord":{"col":4,"row":5},"type":"monster"},{"can_modify":true,"children":[{"col":3,"row":8}],"coord":{"col":4,"row":7},"type":"monster"},{"can_modify":true,"children":[{"col":3,"row":12}],"coord":{"col":4,"row":11},"type":"unknown"},{"can_modify":true,"children":[{"col":4,"row":13}],"coord":{"col":4,"row":12},"type":"rest_site"},{"can_modify":true,"children":[{"col":3,"row":14},{"col":4,"row":14},{"col":5,"row":14}],"coord":{"col":4,"row":13},"type":"unknown"},{"can_modify":true,"children":[{"col":4,"row":15}],"coord":{"col":4,"row":14},"type":"elite"},{"can_modify":false,"children":[{"col":3,"row":16}],"coord":{"col":4,"row":15},"type":"rest_site"},{"can_modify":true,"children":[{"col":6,"row":7},{"col":4,"row":7}],"coord":{"col":5,"row":6},"type":"monster"},{"can_modify":true,"children":[{"col":5,"row":9}],"coord":{"col":5,"row":8},"type":"monster"},{"can_modify":false,"children":[{"col":5,"row":10}],"coord":{"col":5,"row":9},"type":"treasure"},{"can_modify":true,"children":[{"col":5,"row":11}],"coord":{"col":5,"row":10},"type":"unknown"},{"can_modify":true,"children":[{"col":4,"row":12},{"col":5,"row":12}],"coord":{"col":5,"row":11},"type":"unknown"},{"can_modify":true,"children":[{"col":4,"row":13}],"coord":{"col":5,"row":12},"type":"unknown"},{"can_modify":true,"children":[{"col":4,"row":15}],"coord":{"col":5,"row":14},"type":"unknown"},{"can_modify":false,"children":[{"col":6,"row":2}],"coord":{"col":6,"row":1},"type":"monster"},{"can_modify":true,"children":[{"col":6,"row":3}],"coord":{"col":6,"row":2},"type":"monster"},{"can_modify":true,"children":[{"col":6,"row":4}],"coord":{"col":6,"row":3},"type":"monster"},{"can_modify":true,"children":[{"col":6,"row":5}],"coord":{"col":6,"row":4},"type":"monster"},{"can_modify":true,"children":[{"col":6,"row":6}],"coord":{"col":6,"row":5},"type":"monster"},{"can_modify":true,"children":[{"col":6,"row":7}],"coord":{"col":6,"row":6},"type":"shop"},{"can_modify":true,"children":[{"col":6,"row":8},{"col":5,"row":8}],"coord":{"col":6,"row":7},"type":"elite"},{"can_modify":true,"children":[{"col":6,"row":9}],"coord":{"col":6,"row":8},"type":"shop"},{"can_modify":false,"children":[{"col":6,"row":10}],"coord":{"col":6,"row":9},"type":"treasure"},{"can_modify":true,"children":[{"col":6,"row":11},{"col":5,"row":11}],"coord":{"col":6,"row":10},"type":"elite"},{"can_modify":true,"children":[{"col":6,"row":12}],"coord":{"col":6,"row":11},"type":"rest_site"},{"can_modify":true,"children":[{"col":6,"row":13}],"coord":{"col":6,"row":12},"type":"monster"},{"can_modify":true,"children":[{"col":5,"row":14}],"coord":{"col":6,"row":13},"type":"unknown"}],"second_boss":null,"start":{"can_modify":true,"children":[{"col":0,"row":1},{"col":3,"row":1},{"col":4,"row":1},{"col":6,"row":1}],"coord":{"col":3,"row":0},"type":"ancient"},"start_coords":[{"col":3,"row":1},{"col":4,"row":1},{"col":6,"row":1},{"col":0,"row":1}],"width":7}},{"id":"ACT.HIVE","rooms":{"ancient_id":"EVENT.TEZCATARA","boss_encounters_visited":0,"boss_id":"ENCOUNTER.KAISER_CRAB_BOSS","elite_encounter_ids":["ENCOUNTER.INFESTED_PRISMS_ELITE","ENCOUNTER.DECIMILLIPEDE_ELITE","ENCOUNTER.ENTOMANCER_ELITE","ENCOUNTER.DECIMILLIPEDE_ELITE","ENCOUNTER.INFESTED_PRISMS_ELITE","ENCOUNTER.ENTOMANCER_ELITE","ENCOUNTER.INFESTED_PRISMS_ELITE","ENCOUNTER.DECIMILLIPEDE_ELITE","ENCOUNTER.ENTOMANCER_ELITE","ENCOUNTER.INFESTED_PRISMS_ELITE","ENCOUNTER.ENTOMANCER_ELITE","ENCOUNTER.DECIMILLIPEDE_ELITE","ENCOUNTER.INFESTED_PRISMS_ELITE","ENCOUNTER.DECIMILLIPEDE_ELITE","ENCOUNTER.ENTOMANCER_ELITE"],"elite_encounters_visited":0,"event_ids":["EVENT.POTION_COURIER","EVENT.SYMBIOTE","EVENT.SLIPPERY_BRIDGE","EVENT.LOST_WISP","EVENT.FIELD_OF_MAN_SIZED_HOLES","EVENT.ZEN_WEAVER","EVENT.BRAIN_LEECH","EVENT.DOLL_ROOM","E